{
  "skill": "relationship-view",
  "version": "0.1.0",
  "status": "success",
  "mode": "refresh_person_view",
  "target_person": {
    "person_name": "Chris Yu",
    "person_ref": "person_chris_yu",
    "profile_tier": "key"
  },
  "person_view": {
    "person_name": "Chris Yu",
    "person_ref": "person_chris_yu",
    "profile_tier": "key",
    "confidence": "high",
    "refreshed_at": "2026-04-20T12:00:00.000Z",
    "summary_card": {
      "summary": "补贴引擎三层架构的核心设计者和输出者。",
      "current_judgment": "当前处于稳定联系，适合持续跟进其架构输出和对齐进展。",
      "relationship_stage": "稳定联系",
      "intent": "输出可落地的三层架构方案，并通过演示拉齐团队认知。",
      "attitude": {
        "label": "偏积极",
        "reason": "主动输出方案并配合推进。"
      },
      "tags": ["框架负责人", "架构设计者"],
      "traits": ["专业细致", "逻辑清晰"],
      "preferences": ["长期对照桶做效果评估"],
      "boundaries": [],
      "risk_flags": ["三层与两层架构尚未最终确定"],
      "open_questions": [],
      "next_actions": ["跟进架构演示结果"]
    },
    "evidence_summary": {
      "excerpt_count": 3,
      "source_count": 1,
      "last_updated_at": "2026-04-19T11:42:19.609Z",
      "key_evidence": ["输出三层架构设计"]
    },
    "timeline_highlights": [
      {
        "date": "待判断",
        "source_title": "260325会议纪要-补贴引擎默毛输入",
        "source_id": "meeting-minute-2026-03-25-subsidy-engine-mo-input",
        "event_summary": "输出三层架构设计。"
      }
    ],
    "related_people": [
      {
        "person_name": "Mina Yang",
        "person_ref": "person_mina_yang",
        "relation_type": "same_context_and_mentioned",
        "relation_score": 57
      }
    ],
    "graph_snapshot": {
      "node_count": 3,
      "edge_count": 3,
      "pending_edge_count": 2,
      "strongest_connection": {
        "person_name": "Mina Yang",
        "person_ref": "person_mina_yang",
        "relation_type": "same_context_and_mentioned",
        "relation_score": 57
      },
      "mermaid": "flowchart LR\n  person_chris_yu[\"Chris Yu\"]\n  person_mina_yang[\"Mina Yang\"]\n  person_chris_yu --> person_mina_yang"
    },
    "review_snapshot": {
      "required": true,
      "pending_edge_count": 2,
      "edge_candidates": [],
      "review_notes": ["当前仍有待确认关系边。"]
    },
    "user_feedback": {
      "headline": "已生成Chris Yu的局部关系图"
    },
    "markdown_path": "D:\\tester_Bcontext\\skill-system\\relationship-view\\views\\person_chris_yu.md",
    "source_context": {
      "profile_store_path": "D:\\tester_Bcontext\\skill-system\\relationship-ingestion\\incremental-scenarios\\2026-03-25-subsidy-engine-mo-input\\relationship-profile-store.incremental-2026-03-25-subsidy-engine-mo-input.json",
      "graph_review_store_path": "D:\\tester_Bcontext\\skill-system\\relationship-graph\\runtime\\stores\\relationship-graph-review-store.json"
    }
  },
  "refreshed_views": [
    {
      "person_name": "Chris Yu",
      "person_ref": "person_chris_yu",
      "profile_tier": "key",
      "confidence": "high",
      "refreshed_at": "2026-04-20T12:00:00.000Z",
      "pending_edge_count": 2,
      "markdown_path": "D:\\tester_Bcontext\\skill-system\\relationship-view\\views\\person_chris_yu.md"
    }
  ],
  "view_store_overview": {
    "profile_count": 5,
    "view_count": 3,
    "updated_at": "2026-04-20T12:00:00.000Z"
  },
  "view_store_delta": {
    "store_path": "D:\\tester_Bcontext\\skill-system\\relationship-view\\runtime\\stores\\relationship-view-store.json",
    "written": true,
    "markdown_written_count": 1,
    "total_views_after_write": 3,
    "refreshed_people": [
      {
        "person_name": "Chris Yu",
        "person_ref": "person_chris_yu",
        "markdown_path": "D:\\tester_Bcontext\\skill-system\\relationship-view\\views\\person_chris_yu.md"
      }
    ]
  },
  "user_feedback": {
    "headline": "已刷新 Chris Yu 的持续关系视图",
    "summary_lines": [
      "本次刷新人物数：1",
      "其中待确认关系边总数：2",
      "已同步写入 markdown 视图文件"
    ],
    "next_action": {
      "type": "inspect_markdown_views",
      "message": "可以直接打开对应人物的 markdown 视图文件检查 summary 和 graph。"
    }
  },
  "run_directory": null,
  "notes": ""
}
